{
  "$schema": "https://traca.local/schema/traca.exercise-corpus.v1.1.json",
  "meta": {
    "format": "TRACA_corpus_semantic",
    "versio_llenguatge": "1.1.0",
    "versio_corpus": "1.4.0",
    "estat": "validat_i_viu",
    "separacio_capes": {
      "semantica_tactica": "inclosa",
      "sequencia_temporal": "inclosa",
      "flux_pilota": "inclos_quan_ha_estat_validat",
      "relacions_espacials": "incloses",
      "geometria_resolta": "no_inclosa",
      "renderitzat": "no_generat"
    }
  },
  "familia": {
    "id": "MITJANS_1V1_OFENSIUS",
    "nom": "Mitjans 1x1 ofensius",
    "prefix": "TR-UVOF",
    "nombre_exercicis": 15
  },
  "referencies_vocabulari": [
    "CT-1X1-FINTA",
    "CT-2X1",
    "CT-ENCREUAMENT",
    "CT-PERMUTA",
    "CT-BLOQUEIG-ESTATIC",
    "CT-LLISCAMENT-PIVOT",
    "CT-SITUACIO-PARTIT",
    "CT-PUNT-FORT-FEBLE"
  ],
  "exercicis": [
    {
      "id": "TR-UVOF-001",
      "nom": "Finta 1–2 a 2–3 i recuperació per al 2x1 exterior",
      "estat": "validat_entrenador",
      "tipus_exercici": "analitic",
      "origen": {
        "full": "FITXA ORIGINAL / BATERÍA D'ACTIVITATS",
        "fila": 4,
        "formula": "=INDEX(UVUOF;1)",
        "text_original": "El treball consisteix en un treball a dues bandes, on en la primera acció amb 1v1 sobre el banc cap al centre juguem un 2v1 amb PV, i recuperem per rebre del extrem donant importància a la trajectòria per jugar un 2v1 amb extrems"
      },
      "organitzacio": {
        "bandes": 2,
        "execucio": "parallela_i_simetrica"
      },
      "participants": [
        {"id": "CE", "rol_inicial": "central", "equip": "atac"},
        {"id": "L", "rol_inicial": "lateral", "equip": "atac"},
        {"id": "PV", "rol_inicial": "pivot", "equip": "atac"},
        {"id": "EXT", "rol_inicial": "extrem", "equip": "atac"},
        {"id": "D1", "rol_inicial": "primer_defensor", "equip": "defensa"},
        {"id": "D3", "rol_inicial": "tercer_defensor", "equip": "defensa"}
      ],
      "materials": [
        {"id": "BANC", "tipus": "banc", "funcio": "substitut_oposicional_actiu_del_segon_defensor"},
        {"id": "C1_C2", "tipus": "cons", "funcio": "limits_espacials"},
        {"id": "C3", "tipus": "con", "funcio": "referencia_posicional_passiva_del_segon_defensor"}
      ],
      "pilotes": [
        {"id": "B1", "posseidor_inicial": "CE"},
        {"id": "B2", "posseidor_inicial": "EXT"}
      ],
      "fases": [
        {
          "id": "SA1",
          "objectiu": "Superar el segon defensor simulat i generar un 2x1 amb el pivot.",
          "accions": [
            {"ordre": 1, "actor": "L", "accio": "rebre_en_carrera_a_interval_1-2", "estat_coneixement": "validat"},
            {"ordre": 2, "actor": "L", "accio": "finta_en_U_de_1-2_a_2-3", "estat_coneixement": "validat"},
            {"ordre": 3, "actor": "L", "accio": "superar_segon_defensor_simulat", "estat_coneixement": "validat"}
          ],
          "fluxos_pilota": [
            {"pilota_id": "B1", "posseidor_inicial": "CE", "accio": "passada", "posseidor_final": "L"}
          ],
          "decisions": [
            {"id": "D_SA1", "condicio": "tercer_defensor_compromes", "caracter": "disponible", "opcions": ["finalitzacio_lateral", "passada_pivot"]}
          ]
        },
        {
          "id": "SA2",
          "objectiu": "Recuperar sense pilota i atacar directament el carril 1–2.",
          "accions": [
            {"ordre": 1, "actor": "L", "accio": "recuperar_sense_pilota_per_darrere_del_banc", "estat_coneixement": "validat"},
            {"ordre": 2, "actor": "L", "accio": "rebre_orientat_sense_bot", "estat_coneixement": "condicio_tasca"},
            {"ordre": 3, "actor": "L", "accio": "atacar_directament_interval_1-2", "estat_coneixement": "validat"}
          ],
          "fluxos_pilota": [
            {"pilota_id": "B2", "posseidor_inicial": "EXT", "accio": "passada_curta", "posseidor_final": "L"}
          ],
          "decisions": [
            {"id": "D_SA2", "condicio": "primer_defensor_compromes", "caracter": "disponible", "opcions": ["finalitzacio_lateral", "passada_extrem"]}
          ]
        }
      ],
      "invariants": [
        "SA1 és una finta i SA2 és un atac directe, no una finta",
        "el mateix lateral manté la identitat entre les dues subaccions",
        "l'extrem manté amplitud"
      ],
      "condicions_tasca": ["SA2_sense_bot"],
      "validacions_entrenador": [
        "banc_com_a_segon_defensor",
        "finta_1-2_a_2-3",
        "2x1_amb_pivot_i_2x1_amb_extrem"
      ]
    },
    {
      "id": "TR-UVOF-002",
      "nom": "1x1 amb hàndicap i continuïtat o encreuament",
      "estat": "validat_entrenador",
      "tipus_exercici": "analitic",
      "origen": {
        "full": "FITXA ORIGINAL / BATERÍA D'ACTIVITATS",
        "fila": 5,
        "formula": "=INDEX(UVUOF;2)",
        "text_original": "Treball de 1v1 contra defensor amb handicap, que defensa amb chirimbolo agafat. Sempre hem d'anar a intentar superar i fer gol, pero en cas de no poder hem de ser capaços de seguir arrosegant per generar un encreuament per aconseguir una ventatge i seguir atacant l'acció."
      },
      "organitzacio": {
        "defensor_directe": "segon_defensor",
        "simetria": "dues_bandes",
        "defensors_actius": ["D1", "D2", "D3_LOCAL", "D3_OPOSAT"],
        "handicap_exclusiu": "D2_soste_el_xirimbolo"
      },
      "participants": [
        {"id": "L", "rol_inicial": "lateral", "equip": "atac"},
        {"id": "CE", "rol_inicial": "central", "equip": "atac"},
        {"id": "EXT", "rol_inicial": "extrem", "equip": "atac"},
        {"id": "D1", "rol_inicial": "primer_defensor", "equip": "defensa"},
        {"id": "D2", "rol_inicial": "segon_defensor", "equip": "defensa"},
        {"id": "D3_LOCAL", "rol_inicial": "tercer_defensor", "equip": "defensa"},
        {"id": "D3_OPOSAT", "rol_inicial": "tercer_defensor", "equip": "defensa"}
      ],
      "materials": [
        {"id": "XIRIMBOLO", "tipus": "xirimbolo", "funcio": "handicap_defensiu_sostingut_pel_segon_defensor"}
      ],
      "pilotes": [
        {"id": "B1", "posseidor_inicial": "L"}
      ],
      "fases": [
        {
          "id": "F1",
          "objectiu": "Superar el segon defensor i finalitzar; si no és possible, continuar atacant mitjançant un encreuament.",
          "accions": [
            {"ordre": 1, "actor": "L", "accio": "passar_al_company_del_costat_de_l_interval_inicial", "mapatge": {"1-2": "EXT", "2-3": "CE"}, "estat_coneixement": "validat"},
            {"ordre": 2, "actor": "L", "accio": "iniciar_cursa_sense_pilota_cap_a_l_interval_inicial", "estat_coneixement": "validat"},
            {"ordre": 3, "actor": "L", "accio": "rebre_devolucio_en_iniciar_el_canvi_de_direccio", "estat_coneixement": "validat"},
            {"ordre": 4, "actor": "L", "accio": "fintar_entre_intervals_contigus", "estat_coneixement": "validat"},
            {"ordre": 5, "actor": "L", "accio": "arrossegar_defensor_si_no_supera", "estat_coneixement": "validat"},
            {"ordre": 6, "actor": "CE", "accio": "esperar_darrere_del_lateral_per_rebre_de_cara", "condicio": "finta_1-2_a_2-3_i_superacio_amb_ajuda_del_tercer", "estat_coneixement": "validat"},
            {"ordre": 7, "actor": "CE", "accio": "encreuar_per_darrere_del_lateral_i_atacar_1-2", "condicio": "finta_1-2_a_2-3_sense_superacio", "estat_coneixement": "validat"},
            {"ordre": 8, "actor": "EXT", "accio": "encreuar_per_darrere_del_lateral_i_atacar_2-3", "condicio": "finta_2-3_a_1-2_sense_superacio", "estat_coneixement": "validat"},
            {"ordre": 9, "actor": "EXT", "accio": "mantenir_amplitud_i_anticipar_passada_per_finalitzar_a_espai_exterior", "condicio": "finta_2-3_a_1-2_i_superacio_amb_ajuda_del_primer", "estat_coneixement": "validat"}
          ],
          "fluxos_pilota": [
            {"trajectoria_id": "FINTA_12_23", "ordre": 1, "pilota_id": "B1", "posseidor_inicial": "L", "accio": "passada_inicial", "posseidor_final": "EXT"},
            {"trajectoria_id": "FINTA_12_23", "ordre": 2, "pilota_id": "B1", "posseidor_inicial": "EXT", "accio": "devolucio_a_inici_canvi_direccio", "posseidor_final": "L"},
            {"trajectoria_id": "FINTA_12_23", "ordre": 3, "pilota_id": "B1", "posseidor_inicial": "L", "accio": "passada_continuitat_o_encreuament", "posseidor_final": "CE", "condicio": "D3_tanca_el_lateral_o_el_lateral_no_supera"},
            {"trajectoria_id": "FINTA_23_12", "ordre": 1, "pilota_id": "B1", "posseidor_inicial": "L", "accio": "passada_inicial", "posseidor_final": "CE"},
            {"trajectoria_id": "FINTA_23_12", "ordre": 2, "pilota_id": "B1", "posseidor_inicial": "CE", "accio": "devolucio_a_inici_canvi_direccio", "posseidor_final": "L"},
            {"trajectoria_id": "FINTA_23_12", "ordre": 3, "pilota_id": "B1", "posseidor_inicial": "L", "accio": "passada_continuitat_o_encreuament", "posseidor_final": "EXT", "condicio": "D1_tanca_el_lateral_o_el_lateral_no_supera"}
          ],
          "decisions": [
            {"id": "D_12_23_SUPERA", "condicio": "finta_1-2_a_2-3_i_superacio", "caracter": "disponible", "opcions": ["finalitzacio_lateral_si_D3_no_tanca", "passada_central_que_rep_de_cara_i_ataca_3-3_si_D3_tanca"]},
            {"id": "D_12_23_NO_SUPERA", "condicio": "finta_1-2_a_2-3_sense_superacio", "caracter": "disponible", "opcions": ["encreuament_central_per_atacar_1-2"]},
            {"id": "D_23_12_SUPERA", "condicio": "finta_2-3_a_1-2_i_superacio", "caracter": "disponible", "opcions": ["finalitzacio_lateral_si_D1_no_tanca", "passada_extrem_si_D1_tanca_per_finalitzar_espai_exterior"]},
            {"id": "D_23_12_NO_SUPERA", "condicio": "finta_2-3_a_1-2_sense_superacio", "caracter": "disponible", "opcions": ["encreuament_extrem_per_atacar_2-3"]}
          ]
        }
      ],
      "invariants": [
        "la primera intenció és superar i finalitzar",
        "l'encreuament apareix quan no hi ha superació",
        "la resposta depèn de l'interval final atacat pel lateral",